checked_at,space_name,url,page_text
2026-04-25 11:26:03,instabase_test,https://www.instabase.jp/space/5750329482,"403 ERROR
The request could not be satisfied.
Request blocked. We can't connect to the server for this app or website at this time. There might be too much traffic or a configuration error. Try again later, or contact the app or website owner.
If you provide content to customers through CloudFront, you can find steps to troubleshoot and help prevent this error by reviewing the CloudFront documentation.
Generated by cloudfront (CloudFront)
Request ID: qKdw_yuDx4ubH8TSGFFh23O5MoT7pbQL32rph65991_C6rtryHH7aQ=="
